{
  "_comment": "The stage catalog (AR-07): one ordered list shared by the pipeline runner (scripts/ai/pipeline.sh), the progress model and the docs (docs/reference/pipeline.md, generated). The stage ids are public and stable from drupilot 1.0 on: never rename one; a new stage is added at its place. state.json keeps 0.9's coarse stages, derived from these through coarse_stage (CC-20). Fields: id; label; kind (det, det+tab, det+ai, ai, outward); weight (relative effort for the progress percent, provisional: the headline is 'stage k/N', never the percent); when (every condition must hold, from the closed set in conditions); skip_reason (the reason recorded when the named condition is false: the stage is then 'skipped', not absent); tabs (the config/choices.json keys the stage asks, in order: with the router's INTENT first they are the tab sequence of a full run, tests/evals/router/tab-sequence.json; /drupilot-doctor's own DOCTOR_INSTALL belongs to no stage); subs (sub-step ids); outputs; gate (what must hold to leave the stage); coarse_stage (the state.json stage it records, or null); procedure_anchor ({skill, heading}: the skill step, any heading level, that defines the procedure, or null while none does).",
  "schema": 1,
  "conditions": {
    "always": "every run",
    "track:standard": "the upgrade plan's track is standard (a Drupal 8+ source)",
    "track:d7-assisted": "the upgrade plan's track is d7-assisted (a Drupal 7 source)",
    "experimental-d7": "DRUPILOT_EXPERIMENTAL_D7=on",
    "worklist:ai": "worklist.json has open items in an ai-* lane",
    "optin": "the developer opted in (it is never run by default)",
    "user-only": "only the developer starts it (disable-model-invocation)",
    "not-auto": "not in an auto run (DRUPILOT_AUTONOMOUS=true)"
  },
  "stages": [
    {
      "id": "doctor",
      "label": "Check the environment",
      "kind": "det",
      "weight": 1,
      "when": ["always"],
      "tabs": [],
      "subs": [],
      "outputs": ["preflight --json"],
      "gate": "preflight exits 0 for the next stage's profile (INV2)",
      "coarse_stage": null,
      "procedure_anchor": null
    },
    {
      "id": "plan-draft",
      "label": "Draft the upgrade plan",
      "kind": "det+tab",
      "weight": 2,
      "when": ["always"],
      "tabs": ["TARGET_MAJOR", "ALLOW_PRERELEASE", "PHP_TARGET"],
      "subs": [],
      "outputs": ["upgrade plan (draft), frozen in the lock"],
      "gate": "the target major and PHP target are confirmed (a tab, a pre-answer or the auto default); a Drupal 7 source in an auto run stops here (D7-AUTO)",
      "coarse_stage": null,
      "procedure_anchor": {"skill": "ddev-environment", "heading": "2b. Target major and the draft upgrade plan"}
    },
    {
      "id": "setup",
      "label": "Set up the test-bed",
      "kind": "det",
      "weight": 15,
      "when": ["always"],
      "tabs": ["PLACEMENT", "CONFIG_CONFLICT"],
      "subs": [],
      "outputs": ["DDEV test-bed", "toolchain", "rector.php", "phpstan.neon", "phpcs.xml.dist", "lock: core, toolchain, add-ons"],
      "gate": "the toolchain smoke test passes; a hand-edited config is never overwritten (INV5)",
      "coarse_stage": "setup",
      "procedure_anchor": {"skill": "ddev-environment", "heading": "1. Gate the operation"}
    },
    {
      "id": "assess",
      "label": "Assess viability",
      "kind": "det",
      "weight": 10,
      "when": ["always"],
      "tabs": ["EXISTING_WORK"],
      "subs": [],
      "outputs": ["raw/*.json", "findings.json", "assess.json", "viability-report.md"],
      "gate": "none: it always emits a staged plan, even at XL",
      "coarse_stage": "assessed",
      "procedure_anchor": {"skill": "viability-assessment", "heading": "3. Run the static analyses (all non-destructive)"}
    },
    {
      "id": "plan-final",
      "label": "Finalize the upgrade plan",
      "kind": "det+tab",
      "weight": 2,
      "when": ["always"],
      "tabs": ["CORE_TARGET"],
      "subs": [],
      "outputs": ["upgrade plan (final), frozen in the lock"],
      "gate": "the core target is confirmed; the final plan only adds hops or raises the floor over the draft",
      "coarse_stage": null,
      "procedure_anchor": null
    },
    {
      "id": "d7-rewrite",
      "label": "Rewrite Drupal 7 code (experimental)",
      "kind": "det+ai",
      "weight": 25,
      "when": ["track:d7-assisted", "experimental-d7", "not-auto"],
      "tabs": [],
      "subs": [],
      "outputs": ["d7-manifest.json", "scaffolds", "worklist items"],
      "gate": "DRUPILOT_EXPERIMENTAL_D7=on; never in an auto run",
      "coarse_stage": null,
      "procedure_anchor": null
    },
    {
      "id": "upgrade",
      "label": "Upgrade the Drupal API",
      "kind": "det",
      "weight": 10,
      "when": ["track:standard"],
      "tabs": ["DIGESTS_RULES", "PORT_ATTRIBUTES"],
      "subs": ["rector-official", "rector-tests", "digests", "recipes"],
      "outputs": ["raw/*-upgrade-rector*.json"],
      "gate": "Rector reaches a fixpoint within 3 iterations, else a warning",
      "coarse_stage": null,
      "procedure_anchor": {"skill": "minimal-port", "heading": "2. Pass 1 — official Rector (palantirnet/drupal-rector)"}
    },
    {
      "id": "php",
      "label": "Adapt to the PHP target",
      "kind": "det",
      "weight": 5,
      "when": ["always"],
      "tabs": [],
      "subs": [],
      "outputs": ["compat pass changes", "removed-blocking worklist items"],
      "gate": "floor violations and removed constructs become worklist items, never silently dropped",
      "coarse_stage": null,
      "procedure_anchor": null
    },
    {
      "id": "residual",
      "label": "Fix what the tools cannot",
      "kind": "ai",
      "weight": 20,
      "when": ["worklist:ai"],
      "tabs": [],
      "subs": [],
      "outputs": ["result.json (one per item)", "decisions.jsonl"],
      "gate": "per-item and per-file gates; an unresolved item becomes needs-human",
      "coarse_stage": null,
      "procedure_anchor": {"skill": "minimal-port", "heading": "5. Minimal manual changes (what Rector cannot do)"}
    },
    {
      "id": "validate",
      "label": "Validate",
      "kind": "det",
      "weight": 10,
      "when": ["always"],
      "tabs": ["D10_CHECK"],
      "subs": ["phpcbf", "phpcs", "phpstan", "port-safety", "signatures", "deprecations", "core-matrix", "fixpoint"],
      "outputs": ["raw/*-validate-*.json"],
      "gate": "with DRUPILOT_FIXPOINT=enforce, exit 3 when not converged; the info.yml check (INV11)",
      "coarse_stage": null,
      "procedure_anchor": {"skill": "minimal-port", "heading": "6. The validate loop (after each batch of changes)"}
    },
    {
      "id": "test",
      "label": "Test",
      "kind": "det",
      "weight": 15,
      "when": ["always"],
      "tabs": [],
      "subs": ["discover", "baseline", "adapt", "run", "coverage", "refresh"],
      "outputs": ["last-test.json"],
      "gate": "the preservation verdict is computed, never fabricated (INV3)",
      "coarse_stage": "tested",
      "procedure_anchor": {"skill": "test-adaptation", "heading": "5. Run the suites and iterate to green"}
    },
    {
      "id": "report",
      "label": "Report and patch",
      "kind": "det",
      "weight": 3,
      "when": ["always"],
      "tabs": ["LEARN", "NEXT_STEP"],
      "subs": [],
      "outputs": ["port-manifest.json", "port-report.md", "port-summary.json", "local patch"],
      "gate": "port-summary --strict exits 3 on a blocking issue",
      "coarse_stage": "ported",
      "procedure_anchor": {"skill": "minimal-port", "heading": "8. Report and hand off"}
    },
    {
      "id": "refactor",
      "label": "Refactor (opt-in)",
      "kind": "det+ai",
      "weight": 20,
      "when": ["optin"],
      "tabs": ["REFACTOR_SCOPE", "PHPSTAN_LEVEL", "ATTRIBUTE_FLOOR", "D10_CHECK", "LEARN", "NEXT_STEP"],
      "subs": [],
      "outputs": ["refactored code", "port-report.md"],
      "gate": "the test suite stays green",
      "coarse_stage": "refactored",
      "procedure_anchor": {"skill": "full-refactor", "heading": "2. Refactor loop"}
    },
    {
      "id": "contribute",
      "label": "Contribute upstream",
      "kind": "outward",
      "weight": 5,
      "when": ["optin", "user-only", "not-auto"],
      "tabs": ["CONTRIB_MODE", "PUSH"],
      "subs": [],
      "outputs": ["issue text", "merge request", "patch"],
      "gate": "guard-contrib.sh asks before any push; never in an auto run (INV1)",
      "coarse_stage": "contributed",
      "procedure_anchor": {"skill": "drupal-contribution", "heading": "1. Confirm the subject is contributable"}
    }
  ]
}
